<?xml version="1.0" encoding="UTF-8" standalone="no"?>
<!DOCTYPE taqueria SYSTEM "Tacos.dtd">
<taqueria>
  <taco nombre="Alex Sirvent" descripcion="Carne Roquienta, Piedras Galácticas y Queso de la Luna" precio="10.50"/>
  <taco nombre="Héctor Ugarte" descripcion="Pan de Centeno, Carne Vialáctica y Queso de la Luna" precio="45.50"/>
  <taco nombre="Dany Merlo" descripcion="Carne Selecta, Chiles Mercurianos y Queso de la Luna" precio="43.50"/>
  <taco nombre="Poncho Barbosa" descripcion="Carne Cracteriana, Aros de Saturno y Queso de la Luna" precio="99.00"/>
  <taco nombre="Andrés González" descripcion="Ojo de Marciano de Soya, Lechuga Mercuriana y Queso de la Luna" precio="80.50"/>
  <taco nombre="Urbian Le Verrier" descripcion="Patas Lúgubres, Pimienta Saleriana y  Queso de la Luna" precio="76.00"/>
  <taco nombre="Viento Solar" descripcion="Carne Solerina, Aros de Saturno y Queso de la Luna" precio="87.00"/>
  <taco nombre="Apolo" descripcion="Carne Olimpica, Salsa Cohética y Queso de la Luna" precio="87.00"/>
</taqueria>
