<?xml version="1.0" encoding="UTF-8" standalone="no"?>
<!DOCTYPE taqueria SYSTEM "Tacos.dtd">
<taqueria>
  <taco nombre="Señor de los Anillos" descripcion="Aros de Saturno, Carne Maricusi y Queso de la Luna" precio="100.00"/>
  <taco nombre="Encélado" descripcion="Carne de Saturniana, Lechuga Suecaqueji y Aros de Saturno" precio="80.00"/>
  <taco nombre="Titán" descripcion="Carne de Marciano, Aros de Saturno y Salsa Galáctica" precio="30.00"/>
  <taco nombre="Tetis" descripcion="Ojo de Marciano, Lengua de Vaca y Aros de Saturno" precio="40.50"/>
  <taco nombre="Hiperion" descripcion="Pesuñas de Marciano, Nariz de Vaca y Aros de Saturno" precio="99.50"/>
  <taco nombre="Mimas" descripcion="Dedos de Marciano, Chiles Toreados y Aros de Saturno" precio="73.50"/>
  <taco nombre="Dione" descripcion="Patas Chuecas, Salsa de Lengua y Aros de Saturno" precio="84.00"/>
  <taco nombre="Jápeto" descripcion="Carne de Vaca Loca, Salsa Toreada y Aros de Saturno" precio="54.00"/>
  <taco nombre="Rea" descripcion="Nariz de Vaca, Salsa Galáctica y Aros de Saturno" precio="34.50"/>
</taqueria>
